{
  "schema_version": 1,
  "task_id": "fixture-sensitive-write",
  "baseline": {
    "commit": "1111111111111111111111111111111111111111",
    "tree": "2222222222222222222222222222222222222222"
  },
  "requirements": [
    {
      "id": "REQ-001",
      "statement": "The write validates the exact active attempt before mutation.",
      "source": "INV-ATTEMPT-FENCE-001",
      "applies_to": ["SURF-001"],
      "verification": {
        "method": "test",
        "command": "pnpm test -- sensitive-write.test.ts",
        "expected": "The active attempt writes once.",
        "denial_without_effects": "A stale attempt returns a denial and writes nothing."
      }
    },
    {
      "id": "REQ-002",
      "statement": "The sensitive write retains an attributable audit record.",
      "source": "INV-AUDIT-001",
      "applies_to": ["SURF-001"],
      "verification": {
        "method": "test",
        "command": "pnpm test -- sensitive-write.test.ts",
        "expected": "The accepted write records its API Client and attempt.",
        "denial_without_effects": "A denied write creates no success audit record."
      }
    }
  ]
}
